{"dataset_version":"8fd1a3ab69dd74b708d79872c0dad1422df5ed2901aa0651bdd4359953c86336","max_attempts":6,"puzzle_id":"8fa3457f09b96aadcd834487966bd0bb9d8f44eaa5a35366cd71441857a290a5","reference_date":"2026-10-24","schema_version":"kpop-name-guess-puzzle-v1","target":{"canonical_name":"Tahiti","clues":{"debut_year":2012,"description":{"en":"K-pop music group formed in 2012.","pt-BR":"Grupo musical do universo K-pop formado em 2012."}},"entity_type":"group","evidence":[{"fact_base_id":"Q12070509$8215D3ED-DD8B-4F1B-B06E-1BE3613C5CF5","locator":"wikipedia:en:pageid=39142481:revid=1379023923#extract[123:127]","revision_id":1379023923,"source_key":"wikipedia:en","source_url":"https://en.wikipedia.org/w/index.php?curid=39142481&oldid=1379023923"}],"id":"Q12070509","labels":{"en":"Tahiti","pt-BR":"Tahiti (banda)"},"normalized_name":"TAHITI"},"valid_guesses":["ABLUME","ACRUSH","AGUSTD","AHYEON","AIMERS","ALMENG","ALTPOP","AMPIES","ANDBLE","ANDONG","ANISON","ANYANG","ARTHUR","ASHLEY","ATHENA","AUDREY","AURORA","BAEJIN","BAEMON","BAHASA","BAILEY","BALADA","BALLAD","BAMBAM","BATTLE","BESTIE","BIGFLO","BIGHIT","BINNIE","BLANKY","BLKPIK","BLOCKB","BOSTON","BRASIL","BRAZIL","BUBBLE","BUMKEY","BVNDIT","BYULIE","BYULYI","CAISSE","CANADA","CANSAY","CANTAM","CANTAO","CANTON","CARMEN","CASSAY","CATHAY","CGIRLZ","CHAEIN","CHAKRA","CHAMPS","CHANMI","CHANSI","CHEJUI","CHENLE","CHIAYI","CHILIN","CHINES","CHIRAQ","CHODAN","CHOHEE","CHOSON","CHOWON","CHUNJI","CLASSY","CLICKB","CLOVER","CNBLUE","COREIA","CORTIS","DAEHWI","DAEMON","DAEWON","DAHYUN","DARONG","DAYEON","DEFJAM","DENISE","DHOLIC","DOHOON","DOHYON","DONGGU","DOWOON","DOYEON","EGOENT","ELIKIM","ELISIA","EUGENE","EUIJIN","EUNBIN","EUNICE","EUNJIN","EUNSEO","EUNWOO","EXOCBX","EYOUNG","FIDDLE","FLAREU","FLAUTA","FOKIEN","FRENCH","FRISCO","FROMIS","FUJIAN","FUKIEN","GAHYUN","GAVYNJ","GAYOON","GIMHAE","GISEOK","GONGJU","GOWOON","GOYANG","GUHARA","GUITAR","GUNSAN","GUUDAN","HAEBIN","HAERIN","HAEWON","HAIKOU","HANBIN","HANCEU","HANEUL","HANGUK","HANJIN","HANSOL","HARBIN","HARUNA","HASEUL","HAYEON","HEARTB","HEEJIN","HEEJUN","HEESUN","HELONG","HIKARU","HIPHOP","HIYYIH","HMEDIA","HOIHAO","HOIHOW","HONEYG","HUAHSI","HUIJIN","HULUSI","HUNTRX","HWISEO","HYEBIN","HYELIM","HYERAN","HYERIM","HYERIN","HYEWON","HYOEUN","HYOJIN","HYOLYN","HYOMIN","HYORIN","HYUKOH","ICHEON","IERSEY","IHQINC","IMFACT","IMJINA","IMYUNA","INCHON","INGLES","INKODE","ITOYUU","IVELIZ","JACKIE","JAEHEE","JAEHYO","JAELEE","JAEMIN","JEEMIN","JEEWON","JEJUDO","JEJUNG","JENNIE","JEONJU","JERSEY","JIHOON","JIHYUN","JINHAE","JINJIN","JINSOL","JINWOO","JINYEA","JISUNG","JIYEON","JIYOON","JMUSIC","JOARAM","JOHNNY","JOHYUN","JOKWON","JONGHO","JONGUP","JOOBIN","JOONIE","JOSHUA","JOYURI","JUHOON","JUJUSI","JUNGAH","JUNGHA","JUNGMO","JUNGSU","JUNHAN","JUNHUI","JUNIOR","JUNJIN","JUNKEI","JUNSEO","JUYEON","JYPENT","KAACHI","KADOMA","KAKAOM","KANGIN","KANGTA","KARINA","KAZAKH","KEIJOU","KEONHO","KEPLER","KEUMJO","KHANSA","KHINSA","KHITAI","KHORAT","KIHYUN","KIIRAS","KILALA","KIMAIN","KIMASA","KIMDOI","KIMELI","KIMHAE","KIMJIU","KIMLIP","KINSAI","KINSAY","KOREAN","KOTOKO","KOTONE","KOUNBI","KOYOTE","KRISWU","KUHARA","KUNSAN","KYUJIN","LABOUM","LANGKO","LAPONE","LAYEON","LAYSHA","LEEJIN","LEEJUN","LEELEO","LEEQRI","LEESEO","LEESOL","LEOLEE","LONDON","LOOBLE","LOYANG","LUNDEN","MADEIN","MAKEUS","MAPOGU","MARTIN","MATIDA","MERICA","MEXICO","MINGYU","MINHEE","MINJAE","MINNIE","MINSEO","MINUTE","MINWOO","MIRANI","MIYAGI","MIYEON","MOMOKA","MONDAY","MORIYA","MURICA","MUSESA","MYNAME","MYTEEN","NADINE","NAGANO","NAGOIA","NAGOYA","NAHYUN","NAMJOO","NAMWON","NARSHA","NATURE","NAYEON","NDMOON","NEWSUN","NICOLE","NOUERA","NOYUNA","NSONIC","NSSIGN","NTRAIN","NUESTW","OHSION","OMEGAX","ONEDAY","ORANGE","OSANSI","PAPAYA","PEKING","PENIEL","PENPEN","PEQUIM","PLEDIS","POHANG","POHCIN","PUCHON","PURPLE","QRILEE","QUIOTO","RACHEL","RBWINC","REALME","REIAMI","RENJUN","RIRIKA","RURUKA","RYEOUK","RYUJIN","SAEBOM","SAEROM","SAKURA","SAMPLE","SANCIM","SANGAH","SANGDO","SANGIL","SANGIU","SANGJU","SARANG","SAVAGE","SCOUPS","SECRET","SELINE","SEOHAM","SEOHEE","SEOLLI","SEOWON","SEOYUL","SEULGI","SEYEON","SHANSI","SHANXI","SHENDU","SHINEE","SHINVI","SHINYU","SHOWNU","SHUHUA","SISTAR","SIYEON","SIYOON","SKOREA","SMTOWN","SNUPER","SOJUNG","SOKCHO","SOLBIN","SONAMU","SOOBIN","SOODAM","SOOJIN","SOOMIN","SOOPIA","SOYEON","SPEARB","SPINET","STELLA","STPAUL","STRAYA","SUECIA","SUJUAO","SULLIN","SUNDAY","SUNHYE","SUNWOO","SUPERM","SUYEON","SWEDEN","SYDNEY","TAEBIN","TAEJON","TAEMIN","TAGALO","TAHITI","TAIBEI","TAIOAN","TAIPAK","TAIPEI","TAIWAN","TAMBOR","TARGET","TECHNO","TENLEE","THEHUB","THEPRC","THEROC","THESIX","THEUSA","TONYAN","TOQUIO","TOTIGI","TOYAMA","TRENDZ","UIWANG","UNCORE","UPTION","URPRSE","URUMQI","VANNER","VAPINC","VERNON","VICTON","VIOLIN","VIXXLR","VOCALS","WANTED","WARNER","WASSUP","WHEEIN","WINNER","WINTER","WINWIN","WONBIN","WONHEE","WONJIN","WONPIL","WONWOO","WOOBIN","WOOHEE","WOOJIN","WUMUTI","XANGAI","XANXIM","XIJING","XIKERS","XIUMIN","XIYEON","XUANYI","YAEBIN","YECHAN","YEHANA","YENBAI","YEOJIN","YEONJI","YEOONE","YESUNG","YGPLUS","YIHANI","YIYEON","YONGIN","YONNIE","YOOJIN","YOOJOO","YOONJO","YOSEOB","YOUNGK","YUEYUU","YULHEE","YUNJIN","YUUITO","ZHOUMI"],"word_length":6}
